{"schema_version":"redevplugin.host_capability_manifest.v1","publisher_id":"example.publisher","contract_id":"example.documents.v1","contract_version":"1.0.0","capability_id":"example.capability.documents","capability_version":"1.0.0","generated_at":"2026-07-13T12:28:52Z","source_commit":"aaaaaaaaaaaaaaaaaaaaaaaaaaaaaaaaaaaaaaaa","signature_algorithm":"ed25519","signature_key_id":"example-contract-release-test","signature_policy_epoch":"7","signature_revocation_epoch":"11","entries":[{"role":"contract","ref":"capabilities/example.documents/v1.0.0/example.documents.v1.schema.json","media_type":"application/schema+json","sha256":"9436f2bb2917415f28dbdbd16ba31642cf8b573bff6b680c52dc0f00b1756106","size":3564},{"role":"compatibility","ref":"capabilities/example.documents/v1.0.0/example.documents.v1.compatibility.json","media_type":"application/json","sha256":"6be3b67c86ba06a37ad0601186475f31c38b8f97153a7c7fbe769d901a6b29c3","size":240},{"role":"generated_client","ref":"capabilities/example.documents/v1.0.0/example.documents.v1.client.ts","media_type":"text/typescript","sha256":"d97c6e9a555cfc9d4cb64369f1261b19cbcd67d51248e1d187a99e85f85174d2","size":4629},{"role":"notices","ref":"capabilities/example.documents/v1.0.0/example.documents.v1.notices.json","media_type":"application/json","sha256":"7e6aeedea3215a645379aa23a2cc4e5d2173431893a1c8408cb7b5f325d37590","size":130}]}
